{
  "vehicle_detected": true,
  "vehicle_type": "sedan",
  "confidence": 0.86,
  "bbox": [42, 142, 434, 365],
  "source_image": "fixtures/sedan.jpg",
  "image_width": 640,
  "image_height": 480,
  "model_name": "yolo11n.pt + best.pt",
  "model_version": "yolo-detect-plus-vehicle-type-classifier",
  "timestamp": "2026-06-25T03:30:00+00:00",
  "notes": "Fixture for sedan vehicle model selection.",
  "pipeline_mode": "classify",
  "detection_confidence": 0.91,
  "classification_confidence": 0.86
}
