{
  "vehicle_detected": false,
  "vehicle_type": "unknown",
  "confidence": 0.2,
  "bbox": [],
  "source_image": "vehicle_type_lab\\data\\input_images\\test_car.jpg",
  "image_width": 1280,
  "image_height": 720,
  "model_name": "mock_vehicle_type_classifier",
  "model_version": "0.1.0-mock",
  "timestamp": "2026-06-24T02:07:12.899991+00:00",
  "notes": "Input image could not be used; generated unknown mock result. Reason: image file does not exist"
}