{
  "vehicle_detected": true,
  "vehicle_type": "sedan",
  "confidence": 0.91,
  "bbox": [120, 90, 1160, 690],
  "source_image": "examples/sedan_mock.jpg",
  "image_width": 1280,
  "image_height": 720,
  "model_name": "mock_vehicle_type_classifier",
  "model_version": "0.1.0-mock",
  "timestamp": "2026-06-24T10:00:00+08:00",
  "notes": "Mock sedan result for interface testing only."
}

