{
  "vehicle_detected": true,
  "vehicle_type": "suv",
  "confidence": 0.84,
  "bbox": [50, 130, 500, 380],
  "source_image": "fixtures/suv.jpg",
  "image_width": 640,
  "image_height": 480,
  "model_name": "yolo11n.pt + best.pt",
  "model_version": "yolo-detect-plus-vehicle-type-classifier",
  "timestamp": "2026-06-25T03:30:00+00:00",
  "notes": "Fixture for suv vehicle model selection.",
  "pipeline_mode": "classify",
  "detection_confidence": 0.9,
  "classification_confidence": 0.84
}
