{
  "vehicle_detected": true,
  "vehicle_type": "mpv",
  "confidence": 0.88,
  "bbox": [100, 65, 1200, 705],
  "source_image": "examples/mpv_mock.jpg",
  "image_width": 1280,
  "image_height": 720,
  "model_name": "mock_vehicle_type_classifier",
  "model_version": "0.1.0-mock",
  "timestamp": "2026-06-24T10:00:00+08:00",
  "notes": "Mock MPV result for interface testing only."
}

